{
  "schema_version": "1.0",
  "data_classification": "synthetic_no_participant_data",
  "config_id": "SYN-CFG-G0-001",
  "config_version": "1.0.0",
  "baseline_id": "deterministic_fixed_bank_rule_baseline",
  "output_enabled": false,
  "top_k": 3,
  "abstain_input_quality_codes": [
    "unstable"
  ],
  "candidate_bank": {
    "signal_a": [
      {
        "semantic_id": "SYN-SEM-0001",
        "raw_score": 6,
        "probability": 0.6
      },
      {
        "semantic_id": "SYN-SEM-0002",
        "raw_score": 3,
        "probability": 0.3
      },
      {
        "semantic_id": "SYN-SEM-0003",
        "raw_score": 1,
        "probability": 0.1
      }
    ],
    "signal_b": [
      {
        "semantic_id": "SYN-SEM-0002",
        "raw_score": 6,
        "probability": 0.6
      },
      {
        "semantic_id": "SYN-SEM-0003",
        "raw_score": 3,
        "probability": 0.3
      },
      {
        "semantic_id": "SYN-SEM-0001",
        "raw_score": 1,
        "probability": 0.1
      }
    ],
    "signal_c": [
      {
        "semantic_id": "SYN-SEM-0003",
        "raw_score": 5,
        "probability": 0.5
      },
      {
        "semantic_id": "SYN-SEM-0001",
        "raw_score": 3,
        "probability": 0.3
      },
      {
        "semantic_id": "SYN-SEM-0002",
        "raw_score": 2,
        "probability": 0.2
      }
    ],
    "signal_d": [
      {
        "semantic_id": "SYN-SEM-0004",
        "raw_score": 5,
        "probability": 0.5
      },
      {
        "semantic_id": "SYN-SEM-0002",
        "raw_score": 3,
        "probability": 0.3
      },
      {
        "semantic_id": "SYN-SEM-0003",
        "raw_score": 2,
        "probability": 0.2
      }
    ]
  }
}
